{
  "$schema": "../packages/contracts/provider-manifest.schema.json",
  "contract": "io.clayz.presentation.provider-manifest/1.0",
  "provider_id": "builtin-catalog",
  "visibility": "public",
  "rights_context": "public-open-source",
  "human_admission_required": true,
  "allowed_hosts": ["local", "chatgpt-personal"],
  "index": {
    "record_contract": "io.clayz.presentation.index-record/1.0",
    "format": "jsonl",
    "uri": "bundle://public-library/catalog/records.jsonl",
    "refresh_policy": "immutable-release",
    "snapshot": {
      "provider_id": "builtin-catalog",
      "digest": "a54e53695c5a9849fea01d8bb24a104a67096630f36af6a3f38ef96146f9fd95",
      "record_count": 24
    }
  },
  "evolution_methods": {
    "continuous_learning": "deferred",
    "community_aggregation": "deferred",
    "automatic_update": "deferred",
    "cross_source_fusion": "deferred"
  }
}
